"variable","label","labelLong","variableType","databaseStart","variableStart","subject","section","units","description","version","lastUpdated","reviewNotes","ICES.confirmation","Observation..MD.","status"
"active_transport","Daily active transportation","Time spent - active transportation daily","Continuous","cchs2001_p, cchs2003_p, cchs2005_p, cchs2007_2008_p, cchs2009_2010_p, cchs2010_p, cchs2011_2012_p, cchs2012_p, cchs2013_2014_p, cchs2014_p, cchs2015_2016_p, cchs2017_2018_p, cchs2009_m, cchs2010_m, cchs2012_m","DerivedVar::[PAC_4A_cont, PAC_4B_cont], DerivedVar::[PAC_7, PAC_7A, PAC_7B_cont, PAC_8, PAC_8A, PAC_8B_cont], DerivedVar::[PAYDVTTR, PAADVTRV]","Exercise","Health behaviour","mins","","2.2.0","2025-06-30","Variable metadata completed","","","active"
"ADL_01","Help preparing meals","Needs help - preparing meals","Categorical","cchs2001_p, cchs2003_p, cchs2005_p, cchs2007_2008_p, cchs2009_2010_p, cchs2010_p, cchs2011_2012_p, cchs2012_p, cchs2013_2014_p, cchs2014_p, cchs2009_m, cchs2010_m, cchs2012_m, cchs2001_m, cchs2003_m, cchs2005_m, cchs2007_2008_m, cchs2009_2010_m, cchs2011_2012_m, cchs2013_2014_m","cchs2001_p::RACA_6A, cchs2003_p::RACC_6A, cchs2005_p::RACE_6A, cchs2007_2008_p::RAC_6A, cchs2015_2016_p::ADL_005, cchs2017_2018_p::ADL_005, cchs2001_m::RACA_6A, cchs2003_m::RACC_6A, cchs2005_m::RACE_6A, [ADL_01]","ADL","Health status","N/A","","2.2.0","2025-06-30","Variable metadata completed","Yes","","active"
"ADL_01_A","Help preparing meals","Needs help - preparing meals","Categorical","cchs2015_2016_p, cchs2017_2018_p","[ADL_005]","ADL","Health status","N/A","For 2015 onwards, question was reword to 'Because of any physical condition, mental condition or health problem, do you have any difficulty with preparing meals?' If they needed help from another person, it is indicated in the answer categories (Yes need help or Yes no help). In the universe, respondents must said yes to ""Activities of daily living"" before answering this question, therefore the sample size is small.","2.1.0","2025-06-30","Variable metadata completed","","","active"
"ADL_02","Help appointments/errands","Needs help - getting to appointments/errands","Categorical","cchs2001_p, cchs2003_p, cchs2005_p, cchs2007_2008_p, cchs2009_2010_p, cchs2010_p, cchs2011_2012_p, cchs2012_p, cchs2013_2014_p, cchs2014_p, cchs2009_m, cchs2010_m, cchs2012_m, cchs2001_m, cchs2003_m, cchs2005_m, cchs2007_2008_m, cchs2009_2010_m, cchs2011_2012_m, cchs2013_2014_m","cchs2001_p::RACA_6B, cchs2003_p::RACC_6B1, cchs2005_p::RACE_6B1, cchs2007_2008_p::RAC_6B1, cchs2001_m::RACA_6B, cchs2003_m::RACC_6B1, cchs2005_m::RACE_6B1, cchs2007_2008_m::RAC_6B1, [ADL_02]","ADL","Health status","N/A","","2.2.0","2025-06-30","Variable metadata completed","Yes","","active"
"ADL_02_A","Help appointments/errands","Needs help - getting to appointments/errands","Categorical","cchs2015_2016_p, cchs2017_2018_p","[ADL_010]","ADL","Health status","N/A","For 2015 onwards, question was reword to 'Because of any physical condition, mental condition or health problem, do you have any difficulty with running errands such as shopping for groceries?' If they needed help from another person, it is indicated in the answer categories (Yes need help or Yes no help). In the universe, respondents must said yes to ""Activities of daily living"" before answering this question, therefore the sample size is small.","2.1.0","2025-06-30","Variable metadata completed","","","active"
"ADL_03","Help housework","Needs help - doing housework","Categorical","cchs2001_p, cchs2003_p, cchs2005_p, cchs2007_2008_p, cchs2009_2010_p, cchs2010_p, cchs2011_2012_p, cchs2012_p, cchs2013_2014_p, cchs2014_p, cchs2009_m, cchs2010_m, cchs2012_m, cchs2001_m, cchs2003_m, cchs2005_m, cchs2007_2008_m, cchs2009_2010_m, cchs2011_2012_m, cchs2013_2014_m","cchs2001_p::RACA_6C, cchs2003_p::RACC_6C, cchs2005_p::RACE_6C, cchs2007_2008_p::RAC_6C, cchs2001_m::RACA_6C, cchs2003_m::RACC_6C, cchs2005_m::RACE_6C, cchs2007_2008_m::RAC_6C,[ADL_03]","ADL","Health status","N/A","","2.2.0","2025-06-30","Variable metadata completed","Yes","","active"
"ADL_03_A","Help housework","Needs help - doing housework","Categorical","cchs2015_2016_p, cchs2017_2018_p","[ADL_015]","ADL","Health status","N/A","","2.1.0","2025-06-30","Variable metadata completed","","","active"
"ADL_04","Help personal care","Needs help - personal care","Categorical","cchs2001_p, cchs2003_p, cchs2005_p, cchs2007_2008_p, cchs2009_2010_p, cchs2010_p, cchs2011_2012_p, cchs2012_p, cchs2013_2014_p, cchs2014_p, cchs2009_m, cchs2010_m, cchs2012_m,  cchs2001_m, cchs2003_m, cchs2005_m, cchs2007_2008_m, cchs2009_2010_m, cchs2011_2012_m, cchs2013_2014_m","cchs2001_p::RACA_6E, cchs2003_p::RACC_6E, cchs2005_p::RACE_6E, cchs2007_2008_p::RAC_6E, cchs2001_m::RACA_6E, cchs2003_m::RACC_6E, cchs2005_m::RACE_6E, cchs2007_2008_m::RAC_6E,[ADL_04]","ADL","Health status","N/A","","2.2.0","2025-06-30","Variable metadata completed","Yes","","active"
"ADL_04_A","Help personal care","Needs help - personal care","Categorical","cchs2015_2016_p, cchs2017_2018_p","[ADL_020]","ADL","Health status","N/A","","2.1.0","2025-06-30","Variable metadata completed","","","active"
"ADL_05","Help move inside house","Needs help - moving about inside house","Categorical","cchs2001_p, cchs2003_p, cchs2005_p, cchs2007_2008_p, cchs2009_2010_p, cchs2010_p, cchs2011_2012_p, cchs2012_p, cchs2013_2014_p, cchs2014_p, cchs2009_m, cchs2010_m, cchs2012_m, cchs2001_m, cchs2003_m, cchs2005_m, cchs2007_2008_m, cchs2009_2010_m, cchs2011_2012_m, cchs2013_2014_m","cchs2001_p::RACA_6F, cchs2003_p::RACC_6F, cchs2005_p::RACE_6F, cchs2007_2008_p::RAC_6F, cchs2001_m::RACA_6F, cchs2003_m::RACC_6F, cchs2005_m::RACE_6F, cchs2007_2008_m::RAC_6F,[ADL_05]","ADL","Health status","N/A","","2.2.0","2025-06-30","Variable metadata completed","Yes","","active"
"ADL_05_A","Help move inside house","Needs help - moving about inside house","Categorical","cchs2015_2016_p, cchs2017_2018_p","[ADL_025]","ADL","Health status","N/A","","2.1.0","2025-06-30","Variable metadata completed","","","active"
"ADL_06","Help personal finances","Needs help - looking after finances","Categorical","cchs2003_p, cchs2005_p, cchs2007_2008_p, cchs2009_2010_p, cchs2010_p, cchs2011_2012_p, cchs2012_p, cchs2013_2014_p, cchs2014_p, cchs2009_m, cchs2010_m, cchs2012_m, cchs2003_m, cchs2005_m, cchs2007_2008_m, cchs2009_2010_m, cchs2011_2012_m, cchs2013_2014_m","cchs2003_p::RACC_6G, cchs2005_p::RACE_6G, cchs2007_2008_p::RAC_6G, cchs2003_m::RACC_6G, cchs2005_m::RACE_6G, cchs2007_2008_m::RAC_6G, [ADL_06]","ADL","Health status","N/A","","2.2.0","2025-06-30","Variable metadata completed","Yes","","active"
"ADL_06_A","Help personal finances","Needs help - looking after finances","Categorical","cchs2015_2016_p, cchs2017_2018_p","[ADL_030]","ADL","Health status","N/A","","2.1.0","2025-06-30","Variable metadata completed","","","active"
"ADL_07","Help heavy household chores","Needs help - heavy household chores","Categorical","cchs2001_p, cchs2003_p, cchs2005_p, cchs2001_m, cchs2003_m, cchs2005_m","cchs2001_p::RACA_6D, cchs2003_p::RACC_6D, cchs2005_p::RACE_6D, cchs2001_m::RACA_6D, cchs2003_m::RACC_6D, cchs2005_m::RACE_6D","ADL","Health status","N/A","","2.2.0","2025-06-30","Variable metadata completed","Yes","","active"
"ADL_der","Derived help tasks","Derived needs help with tasks","Categorical","cchs2001_p, cchs2003_p, cchs2005_p, cchs2007_2008_p, cchs2009_2010_p, cchs2010_p, cchs2011_2012_p, cchs2012_p, cchs2013_2014_p, cchs2014_p, cchs2015_2016_p, cchs2017_2018_p, cchs2009_m, cchs2010_m, cchs2012_m","DerivedVar::[ADL_01, ADL_02, ADL_03, ADL_04, ADL_05]","ADL","Health status","N/A","","2.2.0","2025-06-30","Variable metadata completed","","","active"
"ADL_score_5","ADL score","Derived using the ADL variables common to all cycles from 2001 to 2014 (ADL_01,  ADL_02,  ADL_03,  ADL_04, ADL_05) to represent the number of tasks that an individual needs help with.","Categorical","cchs2001_p, cchs2003_p, cchs2005_p, cchs2007_2008_p, cchs2009_2010_p, cchs2010_p, cchs2011_2012_p, cchs2012_p, cchs2013_2014_p, cchs2014_p, cchs2015_2016_p, cchs2017_2018_p, cchs2009_m, cchs2010_m, cchs2012_m","DerivedVar::[ADL_01, ADL_02, ADL_03, ADL_04, ADL_05]","ADL","Health status","N/A","","2.2.0","2025-06-30","Variable metadata completed","","","active"
"ADL_score_6","ADL score","Derived using the ADL variables common to all cycles from 2001 to 2014 (ADL_01,  ADL_02,  ADL_03,  ADL_04, ADL_05, ADL_06) to represent the number of tasks that an individual needs help with.","Categorical","cchs2001_p, cchs2003_p, cchs2005_p, cchs2007_2008_p, cchs2009_2010_p, cchs2010_p, cchs2011_2012_p, cchs2012_p, cchs2013_2014_p, cchs2014_p, cchs2015_2016_p, cchs2017_2018_p, cchs2009_m, cchs2010_m, cchs2012_m, cchs2001_m, cchs2003_m, cchs2005_m, cchs2007_2008_m, cchs2009_2010_m, cchs2011_2012_m, cchs2013_2014_m","DerivedVar::[ADL_01, ADL_02, ADL_03, ADL_04, ADL_05, ADL_06]","ADL","Health status","N/A","","2.2.0","2025-06-30","Variable metadata completed","Yes","","active"
"ADLF6R","Help tasks","Needs help with at least one task - (F)","Categorical","cchs2001_p, cchs2003_p, cchs2005_p, cchs2007_2008_p, cchs2009_2010_p, cchs2010_p, cchs2011_2012_p, cchs2012_p, cchs2013_2014_p, cchs2014_p, cchs2009_m, cchs2010_m, cchs2012_m","cchs2001_p::RACAF6, cchs2003_p::RACCF6R, cchs2005_p::RACEF6R, cchs2007_2008_p::RACF6R, [ADLF6R]","ADL","Health status","N/A","","2.2.0","2025-06-30","Variable metadata completed","","","active"
"ADM_MOI_I","","Month of interview","Categorical","cchs2022_m","[ADM_MOI]","Smoking","Health behaviour","Months","","2.2.0","2025-06-30","Variable metadata completed","","","active"
"ADM_RNO","Sequential record number","Sequential record number","Continuous","cchs2001_p, cchs2003_p, cchs2005_p, cchs2007_2008_p, cchs2009_2010_p, cchs2010_p, cchs2011_2012_p, cchs2012_p, cchs2013_2014_p, cchs2014_p, cchs2015_2016_p, cchs2017_2018_p","cchs2001_p::ADMA_RNO, cchs2003_p::ADMC_RNO, cchs2005_p::ADME_RNO, [ADM_RNO]","N/A","N/A","N/A","","2.1.0","2025-06-30","Variable metadata completed","","","active"
"ADM_YOI_I","","Year of interview","Continuous","cchs2022_m","[ADM_YOI]","Smoking","Health behaviour","Years","","2.2.0","2025-06-30","Variable metadata completed","","","active"
"ALC_005","Alcohol in lifetime","In lifetime, ever drank alcohol?","Categorical","cchs2001_p, cchs2003_p, cchs2005_p, cchs2007_2008_p, cchs2015_2016_p, cchs2017_2018_p","cchs2001_p::ALCA_5B, cchs2003_p::ALCC_5B, cchs2005_p::ALCE_5B, cchs2007_2008_p::ALN_1, [ALC_005]","Alcohol","Health behaviour","N/A","","2.1.0","2025-06-30","Variable metadata completed","","","active"
"ALC_1","Alcohol past year","Past year, have you drank alcohol","Categorical","cchs2001_p, cchs2003_p, cchs2005_p, cchs2007_2008_p, cchs2009_2010_p, cchs2010_p, cchs2011_2012_p, cchs2012_p, cchs2013_2014_p, cchs2014_p, cchs2015_2016_p, cchs2017_2018_p, cchs2009_m, cchs2010_m, cchs2012_m","cchs2001_p::ALCA_1, cchs2003_p::ALCC_1, cchs2005_p::ALCE_1, cchs2015_2016_p::ALC_010, cchs2017_2018_p::ALC_010, [ALC_1]","Alcohol","Health behaviour","N/A","","2.2.0","2025-06-30","Variable metadata completed","","","active"
"ALCDTTM","Drinker type (last 12 months)","Type of drinker (12 months)","Categorical","cchs2001_p, cchs2003_p, cchs2005_p, cchs2007_2008_p, cchs2009_2010_p, cchs2010_p, cchs2011_2012_p, cchs2012_p, cchs2013_2014_p, cchs2014_p, cchs2015_2016_p, cchs2017_2018_p, cchs2009_m, cchs2010_m, cchs2012_m, cchs2001_m, cchs2003_m, cchs2005_m, cchs2007_2008_m, cchs2009_2010_m, cchs2011_2012_m, cchs2013_2014_m, cchs2015_2016_m, cchs2017_2018_m","cchs2001_p::ALCADTYP, cchs2003_p::ALCCDTYP, cchs2005_p::ALCEDTYP, cchs2015_2016_p::ALCDVTTM, cchs2017_2018_p::ALCDVTTM, cchs2001_m::ALCADTYP, cchs2003_m::ALCCDTYP, cchs2005_m::ALCEDTYP, cchs2015_2016_m::ALCDVTTM, cchs2017_2018_m::ALCDVTTM, [ALCDTTM]","Alcohol","Health behaviour","N/A","","2.2.0","2025-06-30","Variable metadata completed","Yes","","active"
"ALCDTYP","Drinker type","Type of drinker - (D)","Categorical","cchs2001_p, cchs2003_p, cchs2005_p, cchs2007_2008_p","cchs2001_p::ALCADTYP, cchs2003_p::ALCCDTYP, cchs2005_p::ALCEDTYP, [ALNDTYP]","Alcohol","Health behaviour","N/A","","2.1.0","2025-06-30","Variable metadata completed","","","active"
"ALCDTYP_A","Former drinker","Type of drinker","Categorical","cchs2001_m, cchs2003_m, cchs2005_m, cchs2007_2008_m, cchs2009_2010_m, 2011_2012_m, cchs2013_2014_m, cchs2015_2016_m, cchs2017_2018_m","cchs2001_m::ALCADTYP, cchs2003_m::ALCCDTYP, cchs2005_m::ALCEDTYP, cchs2015_2016_m::ALCDVTTM, cchs2017_2018_m::ALCDVTTM, [ALCDTTM]","Alcohol","Health behaviour","N/A","","2.2.0","2025-06-30","Variable metadata completed","Yes","","active"
"ALW_1","Any alcohol past week","Past week, had any alcohol","Categorical","cchs2001_p, cchs2003_p, cchs2005_p, cchs2007_2008_p, cchs2009_2010_p, cchs2010_p, cchs2011_2012_p, cchs2012_p, cchs2013_2014_p, cchs2014_p, cchs2015_2016_p, cchs2017_2018_p, cchs2009_m,  cchs2010_m, cchs2012_m","cchs2001_p::ALCA_5, cchs2003_p::ALCC_5, cchs2005_p::ALCE_5, cchs2015_2016_p::ALW_005, cchs2017_2018_p::ALW_005, [ALW_1]","Alcohol","Health behaviour","N/A","","2.2.0","2025-06-30","Variable metadata completed","","","active"
"ALW_2A1","# of drinks - Sunday","Number of drinks on Sunday","Continuous","cchs2001_p, cchs2003_p, cchs2005_p, cchs2007_2008_p, cchs2009_2010_p, cchs2010_p, cchs2011_2012_p, cchs2012_p, cchs2013_2014_p, cchs2014_p, cchs2015_2016_p, cchs2017_2018_p, cchs2009_m, cchs2010_m, cchs2012_m, cchs2001_m, cchs2003_m, cchs2005_m, cchs2007_2008_m, cchs2009_2010_m, cchs2011_2012_m, cchs2013_2014_m, cchs2015_2016_m, cchs2017_2018_m","cchs2001_p::ALCA_5A1, cchs2003_p::ALCC_5A1, cchs2005_p::ALCE_5A1, cchs2015_2016_p::ALW_010, cchs2017_2018_p::ALW_010, cchs2001_m::ALCA_5A1, cchs2003_m::ALCC_5A1, cchs2005_m::ALCE_5A1, cchs2015_2016_m::ALW_010, cchs2017_2018_m::ALW_010 , [ALW_2A1]","Alcohol","Health behaviour","drinks","","2.2.0","2025-06-30","Variable metadata completed","","","active"
"ALW_2A2","# of drinks - Monday","Number of drinks on Monday","Continuous","cchs2001_p, cchs2003_p, cchs2005_p, cchs2007_2008_p, cchs2009_2010_p, cchs2010_p, cchs2011_2012_p, cchs2012_p, cchs2013_2014_p, cchs2014_p, cchs2015_2016_p, cchs2017_2018_p, cchs2009_m, cchs2010_m, cchs2012_m, cchs2001_m, cchs2003_m, cchs2005_m, cchs2007_2008_m, cchs2009_2010_m, cchs2011_2012_m, cchs2013_2014_m, cchs2015_2016_m, cchs2017_2018_m","cchs2001_p::ALCA_5A2, cchs2003_p::ALCC_5A2, cchs2005_p::ALCE_5A2, cchs2015_2016_p::ALW_015, cchs2017_2018_p::ALW_015, cchs2001_m::ALCA_5A2, cchs2003_m::ALCC_5A2, cchs2005_m::ALCE_5A2, cchs2015_2016_m::ALW_015, cchs2017_2018_m::ALW_015, [ALW_2A2]","Alcohol","Health behaviour","drinks","","2.2.0","2025-06-30","Variable metadata completed","","","active"
"ALW_2A3","# of drinks - Tuesday","Number of drinks on Tuesday","Continuous","cchs2001_p, cchs2003_p, cchs2005_p, cchs2007_2008_p, cchs2009_2010_p, cchs2010_p, cchs2011_2012_p, cchs2012_p, cchs2013_2014_p, cchs2014_p, cchs2015_2016_p, cchs2017_2018_p, cchs2009_m, cchs2010_m, cchs2012_m, cchs2001_m, cchs2003_m, cchs2005_m, cchs2007_2008_m, cchs2009_2010_m, cchs2011_2012_m, cchs2013_2014_m, cchs2015_2016_m, cchs2017_2018_m","cchs2001_p::ALCA_5A3, cchs2003_p::ALCC_5A3, cchs2005_p::ALCE_5A3, cchs2015_2016_p::ALW_020, cchs2017_2018_p::ALW_020, cchs2001_m::ALCA_5A3, cchs2003_m::ALCC_5A3, cchs2005_m::ALCE_5A3, cchs2015_2016_m::ALW_020, cchs2017_2018_m::ALW_020, [ALW_2A3]","Alcohol","Health behaviour","drinks","","2.2.0","2025-06-30","Variable metadata completed","","","active"
"ALW_2A4","# of drinks - Wednesday","Number of drinks on Wednesday","Continuous","cchs2001_p, cchs2003_p, cchs2005_p, cchs2007_2008_p, cchs2009_2010_p, cchs2010_p, cchs2011_2012_p, cchs2012_p, cchs2013_2014_p, cchs2014_p, cchs2015_2016_p, cchs2017_2018_p, cchs2009_m, cchs2010_m, cchs2012_m, cchs2001_m, cchs2003_m, cchs2005_m, cchs2007_2008_m, cchs2009_2010_m, cchs2011_2012_m, cchs2013_2014_m, cchs2015_2016_m, cchs2017_2018_m","cchs2001_p::ALCA_5A4, cchs2003_p::ALCC_5A4, cchs2005_p::ALCE_5A4, cchs2015_2016_p::ALW_025, cchs2017_2018_p::ALW_025, cchs2001_m::ALCA_5A4, cchs2003_m::ALCC_5A4, cchs2005_m::ALCE_5A4, cchs2015_2016_m::ALW_025, cchs2017_2018_m::ALW_025, [ALW_2A4]","Alcohol","Health behaviour","drinks","","2.2.0","2025-06-30","Variable metadata completed","","","active"
"ALW_2A5","# of drinks - Thursday","Number of drinks on Thursday","Continuous","cchs2001_p, cchs2003_p, cchs2005_p, cchs2007_2008_p, cchs2009_2010_p, cchs2010_p, cchs2011_2012_p, cchs2012_p, cchs2013_2014_p, cchs2014_p, cchs2015_2016_p, cchs2017_2018_p, cchs2009_m, cchs2010_m, cchs2012_m, cchs2001_m, cchs2003_m, cchs2005_m, cchs2007_2008_m, cchs2009_2010_m, cchs2011_2012_m, cchs2013_2014_m, cchs2015_2016_m, cchs2017_2018_m","cchs2001_p::ALCA_5A5, cchs2003_p::ALCC_5A5, cchs2005_p::ALCE_5A5, cchs2015_2016_p::ALW_030, cchs2017_2018_p::ALW_030, cchs2001_m::ALCA_5A5, cchs2003_m::ALCC_5A5, cchs2005_m::ALCE_5A5, cchs2015_2016_m::ALW_030, cchs2017_2018_m::ALW_030, [ALW_2A5]","Alcohol","Health behaviour","drinks","","2.2.0","2025-06-30","Variable metadata completed","","","active"
"ALW_2A6","# of drinks - Friday","Number of drinks on Friday","Continuous","cchs2001_p, cchs2003_p, cchs2005_p, cchs2007_2008_p, cchs2009_2010_p, cchs2010_p, cchs2011_2012_p, cchs2012_p, cchs2013_2014_p, cchs2014_p, cchs2015_2016_p, cchs2017_2018_p, cchs2009_m, cchs2010_m, cchs2012_m, cchs2001_m, cchs2003_m, cchs2005_m, cchs2007_2008_m, cchs2009_2010_m, cchs2011_2012_m, cchs2013_2014_m, cchs2015_2016_m, cchs2017_2018_m","cchs2001_p::ALCA_5A6, cchs2003_p::ALCC_5A6, cchs2005_p::ALCE_5A6, cchs2015_2016_p::ALW_035, cchs2017_2018_p::ALW_035, cchs2001_m::ALCA_5A6, cchs2003_m::ALCC_5A6, cchs2005_m::ALCE_5A6, cchs2015_2016_m::ALW_035, cchs2017_2018_m::ALW_035, [ALW_2A6]","Alcohol","Health behaviour","drinks","","2.2.0","2025-06-30","Variable metadata completed","","","active"
"ALW_2A7","# of drinks - Saturday","Number of drinks on Saturday","Continuous","cchs2001_p, cchs2003_p, cchs2005_p, cchs2007_2008_p, cchs2009_2010_p, cchs2010_p, cchs2011_2012_p, cchs2012_p, cchs2013_2014_p, cchs2014_p, cchs2015_2016_p, cchs2017_2018_p, cchs2009_m, cchs2010_m, cchs2012_m, cchs2001_m, cchs2003_m, cchs2005_m, cchs2007_2008_m, cchs2009_2010_m, cchs2011_2012_m, cchs2013_2014_m, cchs2015_2016_m, cchs2017_2018_m","cchs2001_p::ALCA_5A7, cchs2003_p::ALCC_5A7, cchs2005_p::ALCE_5A7, cchs2015_2016_p::ALW_040, cchs2017_2018_p::ALW_040, cchs2001_m::ALCA_5A7, cchs2003_m::ALCC_5A7, cchs2005_m::ALCE_5A7, cchs2015_2016_m::ALW_040, cchs2017_2018_m::ALW_040, [ALW_2A7]","Alcohol","Health behaviour","drinks","","2.2.0","2025-06-30","Variable metadata completed","","","active"
"ALWDDLY","Average daily consumption","Average daily alcohol consumption","Continuous","cchs2001_p, cchs2003_p, cchs2005_p, cchs2007_2008_p, cchs2009_2010_p, cchs2010_p, cchs2011_2012_p, cchs2012_p, cchs2013_2014_p, cchs2014_p, cchs2015_2016_p, cchs2017_2018_p, cchs2009_m,  cchs2010_m, cchs2012_m","cchs2001_p::ALCADDLY , cchs2003_p::ALCCDDLY , cchs2005_p::ALCEDDLY, cchs2015_2016_p::ALWDVDLY, cchs2017_2018_p::ALWDVDLY, [ALWDDLY]","Alcohol","Health behaviour","drinks/day","","2.2.0","2025-06-30","Variable metadata completed","","","active"
"ALWDVLTR_der","Long Term Drinking Risk","Low drinking - Increased long term risks due to drinking","Categorical","cchs2001_p, cchs2003_p, cchs2005_p, cchs2007_2008_p, cchs2009_2010_p, cchs2010_p, cchs2011_2012_p, cchs2012_p, cchs2013_2014_p, cchs2014_p, cchs2015_2016_p, cchs2017_2018_p, cchs2009_m,  cchs2010_m, cchs2012_m","DerivedVar::[DHH_SEX, ALWDWKY, ALC_1, ALW_1, ALW_2A1, ALW_2A2, ALW_2A3, ALW_2A4, ALW_2A5, ALW_2A6, ALW_2A7]","Alcohol","Health behaviour","N/A","Risk based on Canada's Low Risk Alcohol Drinking Guidelines. Refer to https://osf.io/ykau5/ .","2.2.0","2025-06-30","Variable metadata completed","","","active"
"ALWDVSTR_der","Short Term Drinking Risk","Low drinking - Increased short term risks due to drinking","Categorical","cchs2001_p, cchs2003_p, cchs2005_p, cchs2007_2008_p, cchs2009_2010_p, cchs2010_p, cchs2011_2012_p, cchs2012_p, cchs2013_2014_p, cchs2014_p, cchs2015_2016_p, cchs2017_2018_p, cchs2009_m,  cchs2010_m, cchs2012_m","DerivedVar::[DHH_SEX, ALWDWKY, ALC_1, ALW_1, ALW_2A1, ALW_2A2, ALW_2A3, ALW_2A4, ALW_2A5, ALW_2A6, ALW_2A7]","Alcohol","Health behaviour","N/A","Risk based on Canada's Low Risk Alcohol Drinking Guidelines. Refer to https://osf.io/ykau5/ .","2.2.0","2025-06-30","Variable metadata completed","","","active"
"ALWDWKY","Drinks last week","Weekly consumption of alcohol","Continuous","cchs2001_p, cchs2003_p, cchs2005_p, cchs2007_2008_p, cchs2009_2010_p, cchs2010_p, cchs2011_2012_p, cchs2012_p, cchs2013_2014_p, cchs2014_p, cchs2015_2016_p, cchs2017_2018_p, cchs2009_m, cchs2010_m, cchs2012_m, cchs2001_m, cchs2003_m, cchs2005_m, cchs2007_2008_m, cchs2009_2010_m, cchs2011_2012_m, cchs2013_2014_m, cchs2015_2016_m, cchs2017_2018_m","cchs2001_p::ALCADWKY, cchs2003_p::ALCCDWKY, cchs2005_p::ALCEDWKY, cchs2015_2016_p::ALWDVWKY, cchs2017_2018_p::ALWDVWKY, cchs2001_m::ALCADWKY, cchs2003_m::ALCCDWKY, cchs2005_m:: ALCEDWKY, cchs2015_2016_m::ALWDVWKY, cchs2017_2018_m::ALWDVWKY, [ALWDWKY]","Alcohol","Health behaviour","drinks/week","","2.2.0","2025-06-30","Variable metadata completed","Yes","","active"
"binge_drinker","Binge Drinker","Binge Drinker","Categorical","cchs2001_p, cchs2003_p, cchs2005_p, cchs2007_2008_p, cchs2009_2010_p, cchs2010_p, cchs2011_2012_p, cchs2012_p, cchs2013_2014_p, cchs2014_p, cchs2015_2016_p, cchs2017_2018_p, cchs2009_m,  cchs2010_m, cchs2012_m","DerivedVar::[DHH_SEX, ALW_1, ALW_2A1, ALW_2A2, ALW_2A3, ALW_2A4, ALW_2A5, ALW_2A6, ALW_2A7]","Alcohol","Health behaviour","N/A","","2.2.0","2025-06-30","Variable metadata completed","","","active"
"CCC_031","Asthma","Do you have asthma?","Categorical","cchs2001_p, cchs2003_p, cchs2005_p, cchs2007_2008_p, cchs2009_2010_p, cchs2010_p, cchs2011_2012_p, cchs2012_p, cchs2013_2014_p, cchs2014_p, cchs2015_2016_p, cchs2017_2018_p, cchs2009_m,  cchs2010_m, cchs2012_m","cchs2001_p::CCCA_031, cchs2003_p::CCCC_031, cchs2005_p::CCCE_031, cchs2015_2016_p::CCC_015, cchs2017_2018_p::CCC_015, [CCC_031]","Chronic condition","Health status","N/A","","2.2.0","2025-06-30","Variable metadata completed","","","active"
"CCC_035","Asthma - had symptoms/ attacks","Have you had any asthma symptoms or asthma attacks in the past 12 months?","Categorical","cchs2001_p, cchs2003_p, cchs2005_p, cchs2007_2008_p, cchs2009_2010_p, cchs2010_p, cchs2011_2012_p, cchs2012_p, cchs2013_2014_p, cchs2014_p, cchs2015_2016_p, cchs2017_2018_p, cchs2009_m,  cchs2010_m, cchs2012_m","cchs2001_p::CCCA_035, cchs2003_p::CCCC_035, cchs2005_p::CCCE_035, cchs2015_2016_p::CCC_020, cchs2017_2018_p::CCC_020, [CCC_035]","Chronic condition","Health status","N/A","","2.2.0","2025-06-30","Variable metadata completed","","","active"
"CCC_036","Asthma - took medication","In the past 12 months, have you taken any medicine for asthma such as inhalers, nebulizers, pills, liquids or injections?","Categorical","cchs2001_p, cchs2003_p, cchs2005_p, cchs2007_2008_p, cchs2009_2010_p, cchs2010_p, cchs2011_2012_p, cchs2012_p, cchs2013_2014_p, cchs2014_p, cchs2015_2016_p, cchs2017_2018_p, cchs2009_m,  cchs2010_m, cchs2012_m","cchs2001_p::CCCA_036, cchs2003_p::CCCC_036, cchs2005_p::CCCE_036, cchs2015_2016_p::CCC_025, cchs2017_2018_p::CCC_025, [CCC_036]","Chronic condition","Health status","N/A","","2.2.0","2025-06-30","Variable metadata completed","","","active"
"CCC_041","Fibromyalgia","Do you have Fibromyalgia?","Categorical","cchs2001_p, cchs2003_p, cchs2005_p, cchs2014_p, cchs2015_2016_p, cchs2017_2018_p, cchs2010_m","cchs2001_p::CCCA_041, cchs2003_p::CCCC_041, cchs2005_p::CCCE_041, cchs2015_2016_p::CCC_045, cchs2017_2018_p::CCC_045, [CCC_041]","Chronic condition","Health status","N/A","","2.2.0","2025-06-30","Variable metadata completed","","","active"
"CCC_051","Arthritis/Rheumatism","Do you have arthritis or rheumatism?","Categorical","cchs2001_p, cchs2003_p, cchs2005_p, cchs2007_2008_p, cchs2009_2010_p, cchs2010_p, cchs2011_2012_p, cchs2012_p, cchs2013_2014_p, cchs2014_p, cchs2015_2016_p, cchs2017_2018_p, cchs2009_m, cchs2010_m, cchs2012_m","cchs2001_p::CCCA_051, cchs2003_p::CCCC_051, cchs2005_p::CCCE_051, cchs2015_2016_p::CCC_050, cchs2017_2018_p::CCC_050, [CCC_051]","Chronic condition","Health status","N/A","","2.2.0","2025-06-30","Variable metadata completed","","","active"
"CCC_061","Back problems","Do you have back problems?","Categorical","cchs2001_p, cchs2003_p, cchs2005_p, cchs2007_2008_p, cchs2009_2010_p, cchs2010_p, cchs2011_2012_p, cchs2012_p, cchs2013_2014_p, cchs2014_p, cchs2015_2016_p, cchs2017_2018_p, cchs2009_m, cchs2010_m, cchs2012_m","cchs2001_p::CCCA_061, cchs2003_p::CCCC_061, cchs2005_p::CCCE_061, cchs2015_2016_p::CCC_055, cchs2017_2018_p::CCC_055, [CCC_061]","Chronic condition","Health status","N/A","","2.2.0","2025-06-30","Variable metadata completed","","","active"
"CCC_071","Hypertension","Do you have high blood pressure?","Categorical","cchs2001_p, cchs2003_p, cchs2005_p, cchs2007_2008_p, cchs2009_2010_p, cchs2010_p, cchs2011_2012_p, cchs2012_p, cchs2013_2014_p, cchs2014_p, cchs2015_2016_p, cchs2017_2018_p, cchs2009_m, cchs2010_m, cchs2012_m, cchs2001_m, cchs2003_m, cchs2005_m, cchs2007_2008_m, cchs2009_2010_m, cchs2011_2012_m, cchs2013_2014_m, cchs2015_2016_m, cchs2017_2018_m","cchs2001_p::CCCA_071, cchs2003_p::CCCC_071, cchs2005_p::CCCE_071, cchs2015_2016_p::CCC_065, cchs2017_2018_p::CCC_065, cchs2001_m::CCCA_071, cchs2003_m::CCCC_071, cchs2005_m::CCCE_071, cchs2015_2016_m::CCC_065, cchs2017_2018_m::CCC_065,[CCC_071]","Chronic condition","Health status","N/A","","2.2.0","2025-06-30","Variable metadata completed","Yes","","active"
